{
  "$schema": "https://json-schema.org/draft/2020-12/schema",
  "title": "ActionIntent",
  "type": "object",
  "required": [
    "id",
    "actor",
    "verb"
  ],
  "properties": {
    "id": {
      "type": "string"
    },
    "actor": {
      "type": "string"
    },
    "verb": {
      "type": "string"
    },
    "target": {
      "type": "string"
    },
    "constraints": {
      "type": "object",
      "additionalProperties": true
    }
  },
  "additionalProperties": true
}
